{
  "reasoning_trace": [
    {
      "step": "Read end-to-end",
      "observation": "JIP-26 requests 50,000 JitoSOL (~$12.5m) to fund the Cryptoeconomics subDAO for JTO buybacks and development of three mechanisms (Vault, TWAP, JTO Auction). CSD operates under existing JIP-17 4/6 multisig. Has executed $3.2m in buybacks to date.",
      "inference": "Treasury outflow of known amount to existing governance structure. Need to verify KPI specificity, milestone structure, and buyback supply impact."
    },
    {
      "step": "Identify stakeholders",
      "observation": "Author is drnick. Funds go to Cryptoeconomics subDAO (CSD) with existing 4/6 multisig. JTO token holders affected by buyback operations.",
      "inference": "Three stakeholder groups: proposer (drnick), beneficiary (CSD), affected group (JTO holders)."
    },
    {
      "step": "Scan KPIs and milestones",
      "observation": "Key Outcomes list deliverables but quarterly reports have no defined success thresholds. 'Strengthened data infrastructure' is undefined. No timeline bounds on contract delivery. No staged disbursement - single upfront transfer.",
      "inference": "Non-measurable outcomes and missing milestone-based disbursement structure. Emit vague_kpi and missing_milestone flags."
    },
    {
      "step": "Check permission changes",
      "observation": "Funds go to 'existing 4/6 multisig established in JIP-17' per Specification section. No new authority creation.",
      "inference": "Existing governance structure explicitly mentioned. Not a backdoor. Concentration of $12.5m in 6-person multisig qualifies as centralization (explicit, medium severity)."
    },
    {
      "step": "Assess token supply impact",
      "observation": "Abstract states 'buybacks equivalent to 100% of Jito Network revenue (roughly $12.5m).' Buybacks reduce JTO circulating supply.",
      "inference": "Mandatory token_dilution flag per skill rules. Substantial magnitude but exact % of supply unknown from proposal text. Medium severity."
    },
    {
      "step": "Evaluate technical risk",
      "observation": "Three mechanisms in development stage (Vault, TWAP, JTO Auction). Specification mentions 'contract finalization' for Q1-Q2 2026.",
      "inference": "Smart contract risk on financial mechanisms handling treasury funds. Independent risk from centralization flag. Medium severity."
    }
  ],
  "summary": "JIP-26 requests 50,000 JitoSOL (~$12.5m) for the Cryptoeconomics subDAO to execute JTO buybacks and complete development of Vault, TWAP, and Auction mechanisms. Single upfront transfer to existing JIP-17 4/6 multisig with quarterly reporting requirements.",
  "stakeholders": [
    {
      "name": "drnick",
      "role": "proposer",
      "citation": "Author: drnick"
    },
    {
      "name": "Cryptoeconomics subDAO (CSD)",
      "role": "beneficiary",
      "citation": "the DAO transfers 50,000 JitoSOL to the CSD multi-sig"
    },
    {
      "name": "JTO token holders",
      "role": "affected_group",
      "citation": "buybacks equivalent to 100% of Jito Network revenue"
    }
  ],
  "treasury_impact": {
    "direction": "outflow",
    "amount_usd": 12500000,
    "confidence": "medium",
    "citation": "50,000 JitoSOL in order to empower the CSD to execute buybacks equivalent to 100% of Jito Network revenue (roughly $12.5m)"
  },
  "red_flags": [
    {
      "category": "vague_kpi",
      "detail": "Key Outcomes lack numeric thresholds and completion criteria. 'Strengthened data infrastructure' is undefined, and contract delivery has no binding timeline despite Q1-Q2 2026 mention in Motivation section.",
      "citation": "Strengthened data infrastructure for future automated buyback algorithms",
      "severity": "medium"
    },
    {
      "category": "missing_milestone",
      "detail": "No staged disbursement tied to deliverables. Full 50,000 JitoSOL transferred upfront despite multi-quarter development timeline for Vault and Auction contracts.",
      "citation": "Upon passage, the DAO transfers 50,000 JitoSOL to the CSD multi-sig",
      "severity": "medium"
    },
    {
      "category": "centralization",
      "detail": "Significant treasury allocation ($12.5m equivalent) concentrated in 6-person multisig with discretionary execution authority over buyback operations and development priorities.",
      "citation": "the DAO transfers 50,000 JitoSOL to the CSD multi-sig, governed by its existing 4/6 multisig established in JIP-17",
      "severity": "medium"
    },
    {
      "category": "token_dilution",
      "detail": "Proposal enables buybacks representing 100% of network revenue (~$12.5m), materially affecting JTO circulating supply trajectory. Exact percentage of total supply unknown from proposal text.",
      "citation": "buybacks equivalent to 100% of Jito Network revenue (roughly $12.5m)",
      "severity": "medium"
    },
    {
      "category": "technical_risk",
      "detail": "Three financial mechanisms (Vault, TWAP, JTO Auction) in development stage to be finalized with this funding. Smart contract risk on buyback and auction systems handling treasury assets.",
      "citation": "Vault and Auction contract finalization (Q1–Q2 2026)",
      "severity": "medium"
    }
  ],
  "questions_to_ask": [
    "What are the specific numeric milestones and binding deadlines for Vault and JTO Auction v1 contract delivery?",
    "What measurable criteria define 'strengthened data infrastructure' as a completion outcome?",
    "If the CSD exhausts the 50,000 JitoSOL allocation before completing all deliverables, will remaining work be abandoned or require a new funding request?",
    "What is the planned audit process and timeline for Vault and Auction contracts before mainnet deployment?",
    "What percentage of total JTO circulating supply will the $12.5m in buybacks represent over the funding period?",
    "How are the 4/6 multisig signers selected, and what is the term or rotation policy for CSD multisig members?"
  ],
  "confidence": {
    "overall": "medium",
    "unreadable_sections": [
      "JIP-17 referenced for multisig governance structure but full text not included",
      "Technical specifications for Vault, TWAP, and JTO Auction mechanisms not detailed"
    ]
  }
}